,text,flag,favorited,favoriteCount,replyToSN,created,truncated,replyToSID,id,replyToUID,statusSource,screenName,retweetCount,isRetweet,retweeted,longitude,latitude
412,vamos clubamerica ,1,FALSE,0,NA,31/07/2017 17:28,FALSE,NA,8.92074E+17,NA,"<a href=""http://twitter.com/download/iphone"" rel=""nofollow"">Twitter for iPhone</a>",MandoLomas12,0,FALSE,FALSE,NA,NA
413, fichajesfutmex jlhb33 clubamerica diegolainez10 jajaja higuera y sus comentarios en su momento querian comprar ,1,FALSE,0,Fichajesfutmex,31/07/2017 17:28,TRUE,8.92072E+17,8.92074E+17,3234795040,"<a href=""http://twitter.com/download/android"" rel=""nofollow"">Twitter for Android</a>",israelislas2203,0,FALSE,FALSE,NA,NA
414,hace mucho no veia a mas de dos jugadores de clubamerica mejor aun ver ahi a darwinjr3 ,1,FALSE,0,NA,31/07/2017 17:26,FALSE,NA,8.92074E+17,NA,"<a href=""http://twitter.com/download/android"" rel=""nofollow"">Twitter for Android</a>",IvanRdzGalletas,0,FALSE,FALSE,NA,NA
415, con otro numero sagrado el 4 del capitn furia edsonalvarez19 un tipo que de verdad siente los colores y ,1,FALSE,1,NA,31/07/2017 17:24,TRUE,NA,8.92073E+17,NA,"<a href=""http://twitter.com/download/android"" rel=""nofollow"">Twitter for Android</a>",EnBooker,0,FALSE,FALSE,NA,NA
416,previo america vs atlas copa mx ,1,FALSE,0,NA,31/07/2017 17:22,FALSE,NA,8.92073E+17,NA,"<a href=""https://dlvrit.com/"" rel=""nofollow"">dlvr.it</a>",EmilioLpzG,0,FALSE,FALSE,NA,NA
417,el debut de paul aguilar con america ,1,FALSE,0,NA,31/07/2017 17:22,FALSE,NA,8.92073E+17,NA,"<a href=""https://dlvrit.com/"" rel=""nofollow"">dlvr.it</a>",EmilioLpzG,0,FALSE,FALSE,NA,NA
418, 16titulosdeliga clubamerica reclamo por los dos penaltis q no le cobraron a las aguilas,1,FALSE,0,16TITULOSDELIGA,31/07/2017 17:22,FALSE,8.92066E+17,8.92073E+17,104061860,"<a href=""http://twitter.com/download/iphone"" rel=""nofollow"">Twitter for iPhone</a>",juanlolivares12,0,FALSE,FALSE,NA,NA
419,ni entiendo esto de chivas y america para que darle bola a jugadores que ya no estan no son del equipo ni mucho m ,1,FALSE,0,NA,31/07/2017 17:22,TRUE,NA,8.92073E+17,NA,"<a href=""http://twitter.com/download/android"" rel=""nofollow"">Twitter for Android</a>",CesarGez1,0,FALSE,FALSE,NA,NA
420, 16titulosdeliga clubamerica siempre ha sido un santurron ademas de cinico que lo compre quien no lo conozca ,1,FALSE,0,16TITULOSDELIGA,31/07/2017 17:21,FALSE,8.92066E+17,8.92073E+17,104061860,"<a href=""http://twitter.com/download/android"" rel=""nofollow"">Twitter for Android</a>",Belladiaz02,0,FALSE,FALSE,NA,NA
421, jonatan pena alguna novedad con lo de uribe al clubamerica ,1,FALSE,0,Jonatan_Pena,31/07/2017 17:20,FALSE,NA,8.92072E+17,146967517,"<a href=""http://twitter.com/download/iphone"" rel=""nofollow"">Twitter for iPhone</a>",jaaviertorres,0,FALSE,FALSE,NA,NA
422, asi va nuestro vuelo en la ligabancomermx clubamerica ,1,FALSE,0,NA,31/07/2017 17:19,FALSE,NA,8.92072E+17,NA,"<a href=""http://twitter.com/download/android"" rel=""nofollow"">Twitter for Android</a>",EnBooker,0,FALSE,FALSE,NA,NA
423, record mexico clubamerica pumas jajajaj y se llaman grande y ni asi lo van a llenar,1,FALSE,0,record_mexico,31/07/2017 17:19,FALSE,8.92064E+17,8.92072E+17,27986223,"<a href=""http://twitter.com/download/iphone"" rel=""nofollow"">Twitter for iPhone</a>",gessu77,0,FALSE,FALSE,NA,NA
424,este miercoles 2 de agosto asiste al estadioazteca en la copamx para disfrutar del encuentro clubamerica vs ,1,FALSE,22,NA,31/07/2017 17:19,TRUE,NA,8.92072E+17,NA,"<a href=""http://twitter.com"" rel=""nofollow"">Twitter Web Client</a>",EstadioAzteca,5,FALSE,FALSE,NA,NA
425, edsonalvarez19 clubamerica nunca pierdas el piso edson trabajo y calidad y sobre todo transmite la mistica del ,1,FALSE,0,EdsonAlvarez19,31/07/2017 17:19,TRUE,8.91763E+17,8.92072E+17,2442845818,"<a href=""http://twitter.com/download/iphone"" rel=""nofollow"">Twitter for iPhone</a>",BEAT166,0,FALSE,FALSE,NA,NA
426,buen dia clubamerica vamos cfamerica a ganar el siguiente partido lo lograremos aguilas,1,FALSE,1,NA,31/07/2017 17:18,FALSE,NA,8.92072E+17,NA,"<a href=""http://twitter.com"" rel=""nofollow"">Twitter Web Client</a>",montiel_osorio,0,FALSE,FALSE,NA,NA
427, 71campana edsonalvarez19 clubamerica por eso dice arriba de 8mdd si sigue con ese nivel el proximo verano seria ,1,FALSE,0,71Campana,31/07/2017 17:18,TRUE,8.92071E+17,8.92072E+17,308628382,"<a href=""http://twitter.com/download/android"" rel=""nofollow"">Twitter for Android</a>",LineaAzulcrema1,0,FALSE,FALSE,NA,NA
428, entrate si jlhb33 tuviera que comprar un jugador del clubamerica seria al canterano diegolainez10 ,1,FALSE,19,NA,31/07/2017 17:18,FALSE,NA,8.92072E+17,NA,"<a href=""http://twitter.com/download/android"" rel=""nofollow"">Twitter for Android</a>",Fichajesfutmex,3,FALSE,FALSE,NA,NA
429, pablisaguilar clubamerica eres el mejor pablito,1,FALSE,0,pablisaguilar,31/07/2017 17:17,FALSE,8.91353E+17,8.92072E+17,158769324,"<a href=""http://twitter.com/download/android"" rel=""nofollow"">Twitter for Android</a>",ketu_lemus,0,FALSE,FALSE,NA,NA
430, clubamerica pumasmx estadioazteca ticketmaster me por que dice en la pagina que no hay venta por internet ,1,FALSE,0,ClubAmerica,31/07/2017 17:17,FALSE,8.92052E+17,8.92072E+17,122211977,"<a href=""http://twitter.com/download/android"" rel=""nofollow"">Twitter for Android</a>",Pels17,0,FALSE,FALSE,NA,NA
431,maestro carlos8reinoso el dia que fuiste nuestro eterno numero 8 y el que nadie deberia de usar jamas ,1,FALSE,1,NA,31/07/2017 17:15,TRUE,NA,8.92071E+17,NA,"<a href=""http://twitter.com/download/android"" rel=""nofollow"">Twitter for Android</a>",EnBooker,0,FALSE,FALSE,NA,NA
432,buen dia clubamerica vamos por los 3 puntos en el estadioazteca,1,FALSE,0,NA,31/07/2017 17:14,FALSE,NA,8.92071E+17,NA,"<a href=""http://twitter.com"" rel=""nofollow"">Twitter Web Client</a>",montiel_osorio,0,FALSE,FALSE,NA,NA
433, aca pueden ver la cronica del partido de america vs pachuca felizlunez,1,FALSE,0,NA,31/07/2017 17:14,FALSE,NA,8.92071E+17,NA,"<a href=""http://twitter.com/download/android"" rel=""nofollow"">Twitter for Android</a>",leonardosport4,0,FALSE,FALSE,NA,NA
434, edsonalvarez19 clubamerica bamos america,1,FALSE,0,EdsonAlvarez19,31/07/2017 17:10,FALSE,8.91763E+17,8.9207E+17,2442845818,"<a href=""http://twitter.com/download/android"" rel=""nofollow"">Twitter for Android</a>",victpeiano,0,FALSE,FALSE,NA,NA
435,manchester city pregunto por edsonalvarez19 este verano clubamerica lo vendera hasta el proximo precio arrib ,1,FALSE,1,NA,31/07/2017 17:09,TRUE,NA,8.9207E+17,NA,"<a href=""http://twitter.com/download/android"" rel=""nofollow"">Twitter for Android</a>",LineaAzulcrema1,1,FALSE,FALSE,NA,NA
436, edsonalvarez19 clubamerica son putos los 3 y el oribe el receptor aguila puta,1,FALSE,0,EdsonAlvarez19,31/07/2017 17:09,FALSE,8.91763E+17,8.9207E+17,2442845818,"<a href=""http://twitter.com/download/android"" rel=""nofollow"">Twitter for Android</a>",MyInfo22432645,0,FALSE,FALSE,NA,NA
437,asi juega mateus uribe el nuevo refuerzo del clubamerica ,1,FALSE,0,NA,31/07/2017 17:09,FALSE,NA,8.9207E+17,NA,"<a href=""https://about.twitter.com/products/tweetdeck"" rel=""nofollow"">TweetDeck</a>",chilenamx,0,FALSE,FALSE,NA,NA
438, felizlunes video japonesas cantan usando la playera clasica del clubamerica ,1,FALSE,0,NA,31/07/2017 17:07,FALSE,NA,8.92069E+17,NA,"<a href=""http://www.botize.com"" rel=""nofollow"">Botize</a>",MarySinM,0,FALSE,FALSE,NA,NA
439,hasta el momento la liga sigue manejando el clubamerica vs pumasmx a las 21 00 hrs,1,FALSE,1,NA,31/07/2017 17:07,FALSE,NA,8.92069E+17,NA,"<a href=""http://twitter.com/download/android"" rel=""nofollow"">Twitter for Android</a>",higypop,0,FALSE,FALSE,NA,NA
440, serviciotm hola quisiera saber cuanto cuestan los boletos del clubamerica vs atlasfc ,1,FALSE,0,ServicioTM,31/07/2017 17:07,FALSE,NA,8.92069E+17,2327796481,"<a href=""http://twitter.com/download/android"" rel=""nofollow"">Twitter for Android</a>",championmircha,0,FALSE,FALSE,NA,NA
441, ojala asi sea cabaas un grandeeee cecilio una esperanza 11 dominguez94 clubamerica ,1,FALSE,1,NA,31/07/2017 17:05,FALSE,NA,8.92069E+17,NA,"<a href=""http://twitter.com/download/android"" rel=""nofollow"">Twitter for Android</a>",EnBooker,1,FALSE,FALSE,NA,NA
442, edsonalvarez19 clubamerica bien x ti eres un gran jugador ,1,FALSE,0,EdsonAlvarez19,31/07/2017 17:04,FALSE,8.91763E+17,8.92069E+17,2442845818,"<a href=""http://twitter.com/download/android"" rel=""nofollow"">Twitter for Android</a>",susanisra,0,FALSE,FALSE,NA,NA
443, clubamerica consiguio su primer triunfo con doblete de 11 dominguez94 poco a poco a levantar el vuelo vamo ,1,FALSE,1,ClubAmerica,31/07/2017 17:02,TRUE,NA,8.92068E+17,122211977,"<a href=""http://twitter.com/download/android"" rel=""nofollow"">Twitter for Android</a>",EnBooker,0,FALSE,FALSE,NA,NA
444, felizlunes video japonesas cantan usando la playera clasica del clubamerica ,1,FALSE,0,NA,31/07/2017 17:02,FALSE,NA,8.92068E+17,NA,"<a href=""http://www.botize.com"" rel=""nofollow"">Botize</a>",ColibriNoche,0,FALSE,FALSE,NA,NA
445, evsolid21 record mexico tuzos clubamerica migue luk puntos de vista ,1,FALSE,0,Evsolid21,31/07/2017 17:01,FALSE,8.92063E+17,8.92068E+17,8.28476E+17,"<a href=""http://twitter.com/download/iphone"" rel=""nofollow"">Twitter for iPhone</a>",IngDanM,0,FALSE,FALSE,NA,NA
446,uffff todo un crack grande como tus raices yosoy8a ,1,FALSE,0,NA,31/07/2017 17:01,FALSE,NA,8.92068E+17,NA,"<a href=""http://twitter.com/download/iphone"" rel=""nofollow"">Twitter for iPhone</a>",javierbello1996,0,FALSE,FALSE,NA,NA
447,revisa la cronica de nuestro triunfo del sabado tuzos siempreguilas ,1,FALSE,180,NA,31/07/2017 17:00,FALSE,NA,8.92067E+17,NA,"<a href=""https://studio.twitter.com"" rel=""nofollow"">Media Studio</a>",ClubAmerica,26,FALSE,FALSE,NA,NA
448, estadioazteca clubamerica pumasmx los horarios de taquilla ,1,FALSE,0,EstadioAzteca,31/07/2017 16:56,FALSE,8.91117E+17,8.92066E+17,78923725,"<a href=""http://twitter.com/download/android"" rel=""nofollow"">Twitter for Android</a>",Backmxoficial,0,FALSE,FALSE,NA,NA
449, pumasmx visita el azteca para enfrentar al clubamerica vamos con todo ,1,FALSE,0,PumasMX,31/07/2017 16:51,FALSE,NA,8.92065E+17,78938710,"<a href=""http://twitter.com/download/iphone"" rel=""nofollow"">Twitter for iPhone</a>",GabyPaniaguua,0,FALSE,FALSE,NA,NA
450, clubamerica drsonrisasac bien bien gran accion todo alivia esos ninos les agradaron su internamiento bien por el cfamerica ,1,FALSE,0,ClubAmerica,31/07/2017 16:44,FALSE,8.91841E+17,8.92064E+17,122211977,"<a href=""http://twitter.com/download/android"" rel=""nofollow"">Twitter for Android</a>",teco_mendoza,0,FALSE,FALSE,NA,NA
451, ingdanm record mexico tuzos clubamerica migue luk tambien publica de chivas y tambien lo hace para mal y tambi ,1,FALSE,0,IngDanM,31/07/2017 16:43,TRUE,8.92063E+17,8.92063E+17,3100788470,"<a href=""http://twitter.com/download/android"" rel=""nofollow"">Twitter for Android</a>",Evsolid21,0,FALSE,FALSE,NA,NA
452, ingdanm record mexico tuzos clubamerica migue luk te repito america vende y cecilio fue la figura de la jornada no tiene nada de malo,1,FALSE,0,IngDanM,31/07/2017 16:38,FALSE,8.92061E+17,8.92062E+17,3100788470,"<a href=""http://twitter.com/download/android"" rel=""nofollow"">Twitter for Android</a>",Evsolid21,0,FALSE,FALSE,NA,NA
453,el tecnico miguelherreradt entiende la exigencia de regresar a clubamerica ,1,FALSE,0,NA,31/07/2017 16:38,FALSE,NA,8.92062E+17,NA,"<a href=""http://www.tweetcaster.com"" rel=""nofollow"">TweetCaster for Android</a>",indigoplaya,0,FALSE,FALSE,NA,NA
454, futpicante que saben nuevo acerca de mateus uribe y su llegada al clubamerica ,1,FALSE,1,futpicante,31/07/2017 16:36,FALSE,NA,8.92062E+17,94429039,"<a href=""http://twitter.com/download/iphone"" rel=""nofollow"">Twitter for iPhone</a>",handrycg,0,FALSE,FALSE,NA,NA
455, evsolid21 record mexico tuzos clubamerica migue luk y lo de cecilio es lo notorio del fin de semana atlas es ,1,FALSE,0,Evsolid21,31/07/2017 16:34,TRUE,8.9206E+17,8.92061E+17,8.28476E+17,"<a href=""http://twitter.com/download/iphone"" rel=""nofollow"">Twitter for iPhone</a>",IngDanM,0,FALSE,FALSE,NA,NA
456,pinche memo sigue con su espectaculo cada que juega ,1,FALSE,0,NA,31/07/2017 16:33,FALSE,NA,8.92061E+17,NA,"<a href=""http://twitter.com/download/iphone"" rel=""nofollow"">Twitter for iPhone</a>",chavitogc27,0,FALSE,FALSE,NA,NA
457, clubamerica echa la casa por la ventana y consiente a su aficion ,1,FALSE,0,NA,31/07/2017 16:30,FALSE,NA,8.9206E+17,NA,"<a href=""http://twitter.com"" rel=""nofollow"">Twitter Web Client</a>",deportesWRADIO,0,FALSE,FALSE,NA,NA
458, record mexico edsonalvarez19 clubamerica este jugador es otro nivel no durara mucho en america ,1,FALSE,0,record_mexico,31/07/2017 16:30,FALSE,8.91984E+17,8.9206E+17,27986223,"<a href=""http://twitter.com/download/android"" rel=""nofollow"">Twitter for Android</a>",jlopzf,0,FALSE,FALSE,NA,NA
459,japonesas prefirieron al clubamerica que a los tuzos ,1,FALSE,0,NA,31/07/2017 16:27,FALSE,NA,8.92059E+17,NA,"<a href=""https://about.twitter.com/products/tweetdeck"" rel=""nofollow"">TweetDeck</a>",CriterioHidalgo,0,FALSE,FALSE,NA,NA
460, edsonalvarez19 clubamerica bien edson muchas ganas se ve la diferencia felicidades vamos america ,1,FALSE,0,EdsonAlvarez19,31/07/2017 16:26,FALSE,8.91763E+17,8.92059E+17,2442845818,"<a href=""http://twitter.com/download/android"" rel=""nofollow"">Twitter for Android</a>",RafaelC05674050,0,FALSE,FALSE,NA,NA
461, soyantoniohg clubamerica pumasmx estadioazteca pues los horarios los ponen las televisoras asi que poco les i ,1,FALSE,1,SoyAntonioHG,31/07/2017 16:25,TRUE,8.92058E+17,8.92059E+17,124859528,"<a href=""http://twitter.com/download/android"" rel=""nofollow"">Twitter for Android</a>",victorr10761964,0,FALSE,FALSE,NA,NA
462, victorr10761964 clubamerica pumasmx estadioazteca si a medio dia en cu ese partido es un riesgo ahora en la noche muchisimo peor ,1,FALSE,0,victorr10761964,31/07/2017 16:23,FALSE,8.92057E+17,8.92058E+17,7.62379E+17,"<a href=""http://twitter.com"" rel=""nofollow"">Twitter Web Client</a>",SoyAntonioHG,0,FALSE,FALSE,NA,NA
463, estadiodiario alguna novedad sobre la contratacion de mateus uribe del clubamerica ,1,FALSE,1,EstadioDiario,31/07/2017 16:23,FALSE,NA,8.92058E+17,129364127,"<a href=""http://twitter.com/download/iphone"" rel=""nofollow"">Twitter for iPhone</a>",handrycg,0,FALSE,FALSE,NA,NA
464, clubamerica volve al mas grande memooooooo yosoy8a,1,FALSE,0,ClubAmerica,31/07/2017 16:12,FALSE,8.92051E+17,8.92055E+17,122211977,"<a href=""http://twitter.com/download/iphone"" rel=""nofollow"">Twitter for iPhone</a>",tiburon5870,0,FALSE,FALSE,NA,NA
465, futpicante clubamerica al estadio azteca ,1,FALSE,0,futpicante,31/07/2017 16:10,FALSE,8.92043E+17,8.92055E+17,94429039,"<a href=""http://twitter.com/download/android"" rel=""nofollow"">Twitter for Android</a>",ElmerPrezG1,0,FALSE,FALSE,NA,NA
466, nittron31 futpicante clubamerica con los que tiene son suficientes ,1,FALSE,0,nittron31,31/07/2017 16:08,FALSE,8.9205E+17,8.92054E+17,114506836,"<a href=""http://twitter.com/download/iphone"" rel=""nofollow"">Twitter for iPhone</a>",gerardocruz20,0,FALSE,FALSE,NA,NA
467, clubamerica representando a mexico y al ame les guste o no,1,FALSE,0,ClubAmerica,31/07/2017 16:08,FALSE,8.92051E+17,8.92054E+17,122211977,"<a href=""http://twitter.com/download/android"" rel=""nofollow"">Twitter for Android</a>",Davidherreratnk,0,FALSE,FALSE,NA,NA
468, clubamerica pumasmx estadioazteca si solo quiero los boletos para asistir contra pumas donde los encuentro ,1,FALSE,0,ClubAmerica,31/07/2017 16:05,FALSE,8.92052E+17,8.92054E+17,122211977,"<a href=""http://twitter.com"" rel=""nofollow"">Twitter Web Client</a>",Thug_Mrc,0,FALSE,FALSE,NA,NA
469, clubamerica pumasmx estadioazteca un america vs pumas salir del estadio a las 11 pm es una mala decision ,1,FALSE,3,ClubAmerica,31/07/2017 16:04,FALSE,8.92052E+17,8.92053E+17,122211977,"<a href=""http://twitter.com"" rel=""nofollow"">Twitter Web Client</a>",SoyAntonioHG,0,FALSE,FALSE,NA,NA
470, clubamerica pero el gol mas rapido en su debut con un nuevo equipo ,1,FALSE,0,ClubAmerica,31/07/2017 16:03,FALSE,8.92051E+17,8.92053E+17,122211977,"<a href=""http://twitter.com/download/android"" rel=""nofollow"">Twitter for Android</a>",nortap85,0,FALSE,FALSE,NA,NA
471, clubamerica mega vientos por cecilio se ve que si no lo achican los lenazos se va a convertir en el nuevo cuau,1,FALSE,0,ClubAmerica,31/07/2017 16:03,FALSE,8.92046E+17,8.92053E+17,122211977,"<a href=""http://twitter.com/download/android"" rel=""nofollow"">Twitter for Android</a>",Leandro09031731,0,FALSE,FALSE,NA,NA
472, clubamerica pumasmx estadioazteca quedo horrible el estadio con la remodelacion,1,FALSE,1,ClubAmerica,31/07/2017 16:03,FALSE,8.92052E+17,8.92053E+17,122211977,"<a href=""http://twitter.com/download/iphone"" rel=""nofollow"">Twitter for iPhone</a>",oguerreroj,0,FALSE,FALSE,NA,NA
473,estadio azteca es el estadio mas bonito de mexico,1,FALSE,1,ClubAmerica,31/07/2017 16:03,FALSE,8.92052E+17,8.92053E+17,122211977,"<a href=""http://twitter.com/download/iphone"" rel=""nofollow"">Twitter for iPhone</a>",oguerreroj,0,FALSE,FALSE,NA,NA
474,el mas grande,1,FALSE,1,ClubAmerica,31/07/2017 16:03,FALSE,8.92052E+17,8.92053E+17,122211977,"<a href=""http://twitter.com/download/iphone"" rel=""nofollow"">Twitter for iPhone</a>",oguerreroj,0,FALSE,FALSE,NA,NA
475,america sera campeon,1,FALSE,1,ClubAmerica,31/07/2017 16:03,FALSE,8.92052E+17,8.92053E+17,122211977,"<a href=""http://twitter.com/download/iphone"" rel=""nofollow"">Twitter for iPhone</a>",oguerreroj,0,FALSE,FALSE,NA,NA
476,el maximo campeon,1,FALSE,1,ClubAmerica,31/07/2017 16:03,FALSE,8.92052E+17,8.92053E+17,122211977,"<a href=""http://twitter.com/download/iphone"" rel=""nofollow"">Twitter for iPhone</a>",oguerreroj,0,FALSE,FALSE,NA,NA
477,cuauhtemoc blanco es el mejor jugador de la historia del america,1,FALSE,1,ClubAmerica,31/07/2017 16:03,FALSE,8.92052E+17,8.92053E+17,122211977,"<a href=""http://twitter.com/download/iphone"" rel=""nofollow"">Twitter for iPhone</a>",oguerreroj,0,FALSE,FALSE,NA,NA
478,el america es el equipo mas odiado del mexico odiamemas,1,FALSE,1,ClubAmerica,31/07/2017 16:03,FALSE,8.92052E+17,8.92053E+17,122211977,"<a href=""http://twitter.com/download/iphone"" rel=""nofollow"">Twitter for iPhone</a>",oguerreroj,0,FALSE,FALSE,NA,NA
479,america coapa azteca futbol liga mx,1,FALSE,1,ClubAmerica,31/07/2017 16:03,FALSE,8.92052E+17,8.92053E+17,122211977,"<a href=""http://twitter.com/download/iphone"" rel=""nofollow"">Twitter for iPhone</a>",oguerreroj,0,FALSE,FALSE,NA,NA
480,el america va a clasificar a liguilla con miguel herrera,1,FALSE,1,ClubAmerica,31/07/2017 16:03,FALSE,8.92052E+17,8.92053E+17,122211977,"<a href=""http://twitter.com/download/iphone"" rel=""nofollow"">Twitter for iPhone</a>",oguerreroj,0,FALSE,FALSE,NA,NA
481,miguel herrera hablo del fracaso americanista en la supercopamx ,1,FALSE,1,ClubAmerica,31/07/2017 16:03,FALSE,8.92052E+17,8.92053E+17,122211977,"<a href=""http://twitter.com/download/iphone"" rel=""nofollow"">Twitter for iPhone</a>",oguerreroj,0,FALSE,FALSE,NA,NA
482,necesitamos goles para que el america sea mas espectacular,1,FALSE,1,ClubAmerica,31/07/2017 16:03,FALSE,8.92052E+17,8.92053E+17,122211977,"<a href=""http://twitter.com/download/iphone"" rel=""nofollow"">Twitter for iPhone</a>",oguerreroj,0,FALSE,FALSE,NA,NA
483,oribe peralta es el maximo anotador vigente del toreno,1,FALSE,1,ClubAmerica,31/07/2017 16:03,FALSE,8.92052E+17,8.92053E+17,122211977,"<a href=""http://twitter.com/download/iphone"" rel=""nofollow"">Twitter for iPhone</a>",oguerreroj,0,FALSE,FALSE,NA,NA
484,el club america es el conjunto de las aguilas y juega en mexico,1,FALSE,1,ClubAmerica,31/07/2017 16:03,FALSE,8.92052E+17,8.92053E+17,122211977,"<a href=""http://twitter.com/download/iphone"" rel=""nofollow"">Twitter for iPhone</a>",oguerreroj,0,FALSE,FALSE,NA,NA
485,leo que hay dos penales que no le marcan al america,1,FALSE,1,ClubAmerica,31/07/2017 16:03,FALSE,8.92052E+17,8.92053E+17,122211977,"<a href=""http://twitter.com/download/iphone"" rel=""nofollow"">Twitter for iPhone</a>",oguerreroj,0,FALSE,FALSE,NA,NA
486,primera vez que el america tiene plantel completo desde febrero del 2016,1,FALSE,1,ClubAmerica,31/07/2017 16:03,FALSE,8.92052E+17,8.92053E+17,122211977,"<a href=""http://twitter.com/download/iphone"" rel=""nofollow"">Twitter for iPhone</a>",oguerreroj,0,FALSE,FALSE,NA,NA
487,lesiones y sanciones asi se llama la enfermedad del america,1,FALSE,1,ClubAmerica,31/07/2017 16:03,FALSE,8.92052E+17,8.92053E+17,122211977,"<a href=""http://twitter.com/download/iphone"" rel=""nofollow"">Twitter for iPhone</a>",oguerreroj,0,FALSE,FALSE,NA,NA
488,para telegraph el uniforme del america es el 15 mas bonito del mundo,1,FALSE,1,ClubAmerica,31/07/2017 16:03,FALSE,8.92052E+17,8.92053E+17,122211977,"<a href=""http://twitter.com/download/iphone"" rel=""nofollow"">Twitter for iPhone</a>",oguerreroj,0,FALSE,FALSE,NA,NA
489,america jugara esta temporada con 4 fuerzas basicas,1,FALSE,1,ClubAmerica,31/07/2017 16:03,FALSE,8.92052E+17,8.92053E+17,122211977,"<a href=""http://twitter.com/download/iphone"" rel=""nofollow"">Twitter for iPhone</a>",oguerreroj,0,FALSE,FALSE,NA,NA
490,el chiquitibum fue creado por el america,1,FALSE,1,ClubAmerica,31/07/2017 16:03,FALSE,8.92052E+17,8.92053E+17,122211977,"<a href=""http://twitter.com/download/iphone"" rel=""nofollow"">Twitter for iPhone</a>",oguerreroj,0,FALSE,FALSE,NA,NA
491,el piojo va a hacer campeon al america,1,FALSE,1,ClubAmerica,31/07/2017 16:03,FALSE,8.92052E+17,8.92053E+17,122211977,"<a href=""http://twitter.com/download/iphone"" rel=""nofollow"">Twitter for iPhone</a>",oguerreroj,0,FALSE,FALSE,NA,NA
492,veremos al america mas joven de la historia reciente en la liga mx torneo apertura 2017,1,FALSE,1,ClubAmerica,31/07/2017 16:03,FALSE,8.92052E+17,8.92053E+17,122211977,"<a href=""http://twitter.com/download/iphone"" rel=""nofollow"">Twitter for iPhone</a>",oguerreroj,0,FALSE,FALSE,NA,NA
493,como olvidar la remontada frente al cruz azul,1,FALSE,1,ClubAmerica,31/07/2017 16:03,FALSE,8.92052E+17,8.92053E+17,122211977,"<a href=""http://twitter.com/download/iphone"" rel=""nofollow"">Twitter for iPhone</a>",oguerreroj,0,FALSE,FALSE,NA,NA
494,remontadas esa es la historia del america,1,FALSE,1,ClubAmerica,31/07/2017 16:03,FALSE,8.92052E+17,8.92053E+17,122211977,"<a href=""http://twitter.com/download/iphone"" rel=""nofollow"">Twitter for iPhone</a>",oguerreroj,0,FALSE,FALSE,NA,NA
495,el america es el equipo mas grande de mexico,1,FALSE,1,ClubAmerica,31/07/2017 16:03,FALSE,8.92052E+17,8.92053E+17,122211977,"<a href=""http://twitter.com/download/iphone"" rel=""nofollow"">Twitter for iPhone</a>",oguerreroj,0,FALSE,FALSE,NA,NA
496,el clasico entre el america y las chivas rayadas,1,FALSE,1,ClubAmerica,31/07/2017 16:03,FALSE,8.92052E+17,8.92053E+17,122211977,"<a href=""http://twitter.com/download/iphone"" rel=""nofollow"">Twitter for iPhone</a>",oguerreroj,0,FALSE,FALSE,NA,NA
497,el america siempre sera el mas grande,1,FALSE,1,ClubAmerica,31/07/2017 16:03,FALSE,8.92052E+17,8.92053E+17,122211977,"<a href=""http://twitter.com/download/iphone"" rel=""nofollow"">Twitter for iPhone</a>",oguerreroj,0,FALSE,FALSE,NA,NA
498,la monumental es la barra de hinchas del america en mexico,1,FALSE,1,ClubAmerica,31/07/2017 16:03,FALSE,8.92052E+17,8.92053E+17,122211977,"<a href=""http://twitter.com/download/iphone"" rel=""nofollow"">Twitter for iPhone</a>",oguerreroj,0,FALSE,FALSE,NA,NA
499,el america debe ser el unico equipo que juegue en el azteca,1,FALSE,1,ClubAmerica,31/07/2017 16:03,FALSE,8.92052E+17,8.92053E+17,122211977,"<a href=""http://twitter.com/download/iphone"" rel=""nofollow"">Twitter for iPhone</a>",oguerreroj,0,FALSE,FALSE,NA,NA
500,el america esta lleno de crack,1,FALSE,1,ClubAmerica,31/07/2017 16:03,FALSE,8.92052E+17,8.92053E+17,122211977,"<a href=""http://twitter.com/download/iphone"" rel=""nofollow"">Twitter for iPhone</a>",oguerreroj,0,FALSE,FALSE,NA,NA
501,a punta de defender aguantar y gracias a bejarano se clasifico pero asi no se puede seguir sevieneelcali vamosamerica asacudirse,0,FALSE,0,NA,27/07/2017 02:24,FALSE,NA,8.90E+17,NA,"<a href=""http://twitter.com/download/android"" rel=""nofollow"">Twitter for Android</a>",pipefm69,1,FALSE,FALSE,NA,NA
502,yo no se pero este juego desdibujado del americadecali me preocupa y ht que vamosamerica,0,FALSE,0,NA,27/07/2017 02:10,FALSE,NA,8.90E+17,NA,"<a href=""http://twitter.com/download/android"" rel=""nofollow"">Twitter for Android</a>",Hadres26,0,FALSE,FALSE,NA,NA
503,hoy juegan 2 de nuestros equipos por copaaguila vamoscali vamosamerica hoy apoyo total hoy ambos avanzaran a ,0,FALSE,0,NA,26/07/2017 16:18,FALSE,NA,8.90E+17,NA,"<a href=""http://www.facebook.com/twitter"" rel=""nofollow"">Facebook</a>",DelPuentePaca,0,FALSE,FALSE,NA,NA
504,este ano tengo ire a las visitas en morelia y leon y por su puesto a todos los que sean en casa comienza el verd ,0,FALSE,1,NA,20/07/2017 17:14,TRUE,NA,8.88E+17,NA,"<a href=""http://twitter.com"" rel=""nofollow"">Twitter Web Client</a>",Juanito_70Mex,0,FALSE,FALSE,NA,NA
505, supercopamx transmision en vivo directo 26jul copamx rayados monterrey vs celaya en vivo parlay ,0,FALSE,0,NA,26/07/2017 23:58,FALSE,NA,8.90E+17,NA,"<a href=""http://www.facebook.com/twitter"" rel=""nofollow"">Facebook</a>",unicornparlay,0,FALSE,FALSE,NA,NA
506, supercopamx transmision en vivo directo 26jul copamx rayados monterrey vs celaya en vivo parlay ,0,FALSE,0,NA,26/07/2017 23:55,TRUE,NA,8.90E+17,NA,"<a href=""http://twitter.com/#!/download/ipad"" rel=""nofollow"">Twitter for iPad</a>",sportsbetparlay,0,FALSE,FALSE,NA,NA
507, supercopamx transmision en vivo directo zacatepec vs cruzazul en vivo futbol 26jul parlay ,0,FALSE,0,NA,26/07/2017 23:40,TRUE,NA,8.90E+17,NA,"<a href=""http://twitter.com/#!/download/ipad"" rel=""nofollow"">Twitter for iPad</a>",sportsbetparlay,0,FALSE,FALSE,NA,NA
